{
  "schema_version": "1.0",
  "catalog": "家庭书架 147 条书目知识卡",
  "source_catalog": "library/bookshelf.json",
  "generated_by": "library/book-knowledge/build.py",
  "source_grade_legend": {
    "A": "已读原文（本库不适用）",
    "B": "基于公认公开书目知识与既有稳定资料；可讲大意，不编页码或原句",
    "C": "仅目录/书名/家长备注；只介绍主题，细节须先看实体书或可靠资料"
  },
  "records": [
    {
      "book_id": "bk-0001",
      "group": "child-text",
      "group_label": "儿童·纯文字与进阶",
      "entry_type": "series",
      "audience": "child",
      "age_hint": "9–12",
      "use_modes": [
        "child_read",
        "co_read",
        "discuss"
      ],
      "topics": [
        "奇幻冒险",
        "成长",
        "友情",
        "长篇系列"
      ],
      "title": "猫小九历险记（文字版，2–15 册）",
      "author": "奇喵君故事",
      "catalog_category": "奇幻冒险小说",
      "catalog_source": "书架实拍 IMG_5691",
      "catalog_note": "2 初露锋芒/3 荣耀之路/4 莽原大地/5 突破重围/6 天才…/7 大赛…/8 神火初燃/9 众志成城/10 久别重逢/11 破茧成蝶/12 星火燎原/13 七曜书院/14 一往无前/15 脱胎换骨；册数多=超长陪伴线",
      "gist": "《猫小九历险记》的文字版第2至15册，是一条围绕猫小九与伙伴冒险成长的超长系列。具体角色关系和剧情以孩子读到的册数为准。",
      "child_bridge": "你已经在跟猫小九一起冒险了。文字版里有没有哪一段是你很想讲给我听的？我不猜后面，听你说。",
      "use_when": [
        "孩子已经在读这套书",
        "孩子愿意从漫画转向文字版",
        "想聊角色和冒险"
      ],
      "talk_angles": [
        "让孩子复述她最喜欢的一段",
        "比较漫画画面和文字怎样写心理"
      ],
      "guardrail": "不假装读过全部册数；不猜人物、结局或前后册关系；由孩子提供页面再聊细节",
      "source_grade": "C",
      "source_note": "仅家庭目录与家长备注，未核全书；具体剧情和人物以实体书为准",
      "related_ids": [
        "bk-0002"
      ]
    },
    {
      "book_id": "bk-0002",
      "group": "child-picture-bridge",
      "group_label": "儿童·图文书与桥梁书",
      "entry_type": "series",
      "audience": "child",
      "age_hint": "8–10",
      "use_modes": [
        "child_read",
        "co_read",
        "discuss"
      ],
      "topics": [
        "奇幻冒险",
        "漫画",
        "伙伴关系",
        "勇气"
      ],
      "title": "猫小九历险记 漫画版（5、6）",
      "author": "奇喵君故事",
      "catalog_category": "漫画",
      "catalog_source": "书架实拍 IMG_5691",
      "catalog_note": "",
      "gist": "《猫小九历险记》的漫画版第5、6册，用连续画面讲猫小九和伙伴在奇幻世界里的冒险与成长。具体人物和剧情以孩子手里的版本为准。",
      "child_bridge": "同一段冒险，漫画和文字会有什么不一样的讲法？你觉得哪一种更像猫小九心里真正想的？",
      "use_when": [
        "孩子主动聊猫小九",
        "孩子愿意比较漫画版与文字版"
      ],
      "talk_angles": [
        "比较画面的表情和文字里的心理",
        "聊伙伴之间怎样互相信任"
      ],
      "guardrail": "不编造具体页码、台词、人物关系或后文；先看孩子提供的页面",
      "source_grade": "C",
      "source_note": "仅家庭目录与家长备注，未核全书；只作入口提示",
      "related_ids": [
        "bk-0001"
      ]
    },
    {
      "book_id": "bk-0003",
      "group": "child-picture-bridge",
      "group_label": "儿童·图文书与桥梁书",
      "entry_type": "series",
      "audience": "child",
      "age_hint": "7–11",
      "use_modes": [
        "child_read",
        "co_read",
        "discuss"
      ],
      "topics": [
        "中国历史",
        "历史漫画",
        "猫",
        "朝代"
      ],
      "title": "如果历史是一群喵（2 春秋战国/3 秦楚两汉/4 东汉末年/6 魏晋南北朝/15 大清风云）",
      "author": "肥志",
      "catalog_category": "历史漫画",
      "catalog_source": "书架实拍 IMG_5690",
      "catalog_note": "",
      "gist": "用一群猫扮演历史人物，按朝代讲中国历史大事件。它更像历史入口，不是严肃史学读物。",
      "child_bridge": "如果让一群猫来演古代人物，你觉得哪只猫最像秦始皇？为什么？",
      "use_when": [
        "孩子喜欢猫或漫画",
        "聊到朝代、历史人物",
        "想从漫画进入历史"
      ],
      "talk_angles": [
        "比较同一朝代的不同人物选择",
        "把漫画事件和课本时间线对照"
      ],
      "guardrail": "漫画会压缩和简化历史；不把搞笑台词当史料，不延伸未画到的内容",
      "source_grade": "B",
      "source_note": "既有公共书目与作品定位知识，未逐页核对；具体册次内容以实体书为准",
      "related_ids": [
        "bk-0004",
        "bk-0005",
        "bk-0199"
      ]
    },
    {
      "book_id": "bk-0004",
      "group": "child-picture-bridge",
      "group_label": "儿童·图文书与桥梁书",
      "entry_type": "series",
      "audience": "child",
      "age_hint": "8–11",
      "use_modes": [
        "child_read",
        "co_read",
        "discuss"
      ],
      "topics": [
        "史记",
        "历史人物",
        "文言启蒙",
        "漫画"
      ],
      "title": "笑读史记（多册：本纪一、列传一/二/五/七/八 等）",
      "author": "洋洋兔",
      "catalog_category": "历史漫画",
      "catalog_source": "书架实拍 IMG_5688/5689/5690 + 家长补充",
      "catalog_note": "",
      "gist": "用漫画改编《史记》里的人物故事，覆盖本纪、列传等多种篇章。适合作为人物故事入口。",
      "child_bridge": "如果历史人物也像漫画角色一样有优点和毛病，你最想先看谁的列传？",
      "use_when": [
        "孩子读到课本里的史记人物",
        "喜欢历史漫画",
        "问某个古人是谁"
      ],
      "talk_angles": [
        "先看人物做了什么选择",
        "再问司马迁可能为什么这样写"
      ],
      "guardrail": "这是改编，不是《史记》原文；不把漫画对白当文言原句",
      "source_grade": "B",
      "source_note": "既有公共书目知识，未逐页核对；不引用原文",
      "related_ids": [
        "bk-0003"
      ]
    },
    {
      "book_id": "bk-0005",
      "group": "child-picture-bridge",
      "group_label": "儿童·图文书与桥梁书",
      "entry_type": "single",
      "audience": "child",
      "age_hint": "7–12",
      "use_modes": [
        "child_read",
        "co_read",
        "discuss"
      ],
      "topics": [
        "百科",
        "机械原理",
        "图解",
        "科学"
      ],
      "title": "DK 拆解万物大百科",
      "author": "DK",
      "catalog_category": "科普百科",
      "catalog_source": "书架实拍 IMG_5683",
      "catalog_note": "",
      "gist": "DK 的图解百科，把日常物品、机器和自然现象拆开，用剖面图和短说明讲它们怎样工作。",
      "child_bridge": "你有没有想过，一个东西如果被拆开，里面会藏着哪些小零件和巧办法？",
      "use_when": [
        "孩子问“这是怎么工作的”",
        "喜欢翻图、找细节",
        "想动手做东西"
      ],
      "talk_angles": [
        "先猜原理再看图",
        "找一个家里的物品对照"
      ],
      "guardrail": "图是示意，不等于真实拆解步骤；涉及电器或危险部件时不由孩子自行尝试",
      "source_grade": "B",
      "source_note": "既有公共书目与 DK 系列稳定知识，未逐页核对",
      "related_ids": [
        "bk-0006",
        "bk-0036",
        "bk-0207"
      ]
    },
    {
      "book_id": "bk-0006",
      "group": "child-picture-bridge",
      "group_label": "儿童·图文书与桥梁书",
      "entry_type": "single",
      "audience": "child",
      "age_hint": "9–13",
      "use_modes": [
        "child_read",
        "co_read",
        "discuss"
      ],
      "topics": [
        "大历史",
        "宇宙",
        "人类",
        "时间线"
      ],
      "title": "DK 大历史：从宇宙大爆炸到我们人类的未来（138 亿年的非凡旅程）",
      "author": "大卫·克里斯蒂安",
      "catalog_category": "科普/大历史",
      "catalog_source": "书架实拍 IMG_5685",
      "catalog_note": "",
      "gist": "把宇宙大爆炸、地球形成、生命演化和人类历史串成一条约138亿年的大时间线，帮助孩子建立“世界从哪来”的整体感。",
      "child_bridge": "如果把宇宙的138亿年压缩成一天，人类可能只在最后几分钟才出现，你觉得前面那么长时间都在发生什么？",
      "use_when": [
        "孩子问宇宙、恐龙、人类起源",
        "想理解历史之前发生了什么"
      ],
      "talk_angles": [
        "用时间尺度做比较",
        "把自然史和人类史接起来"
      ],
      "guardrail": "不把科普书里的年代和模型当成绝对定论；具体数字以版本为准",
      "source_grade": "B",
      "source_note": "既有公共书目与 DK 系列稳定知识，未逐页核对",
      "related_ids": [
        "bk-0007",
        "bk-0114",
        "bk-0146"
      ]
    },
    {
      "book_id": "bk-0007",
      "group": "child-picture-bridge",
      "group_label": "儿童·图文书与桥梁书",
      "entry_type": "single",
      "audience": "child",
      "age_hint": "9–13",
      "use_modes": [
        "child_read",
        "co_read",
        "discuss"
      ],
      "topics": [
        "世界史",
        "时间线",
        "比较",
        "百科"
      ],
      "title": "DK 时间线上的全球史",
      "author": "DK",
      "catalog_category": "历史百科",
      "catalog_source": "书架实拍 IMG_5685",
      "catalog_note": "",
      "gist": "用时间线和图表并排呈现不同地区的历史，让孩子看到同一时期中国与世界别处各发生了什么。",
      "child_bridge": "中国开始某个朝代的时候，地球另一边的人正在做什么？我们能不能把两条时间线放到一起看？",
      "use_when": [
        "孩子喜欢看地图或年表",
        "问“同一时候别人在干什么”",
        "学历史容易只背中国史"
      ],
      "talk_angles": [
        "找同一时间点的两三件事",
        "比较不同文明的节奏"
      ],
      "guardrail": "同时代不等于互相影响；不把并置的时间线误读成因果关系",
      "source_grade": "B",
      "source_note": "既有公共书目与 DK 系列稳定知识，未逐页核对",
      "related_ids": [
        "bk-0006",
        "bk-0015",
        "bk-0154"
      ]
    },
    {
      "book_id": "bk-0008",
      "group": "child-picture-bridge",
      "group_label": "儿童·图文书与桥梁书",
      "entry_type": "single",
      "audience": "child",
      "age_hint": "9–13",
      "use_modes": [
        "child_read",
        "co_read",
        "discuss"
      ],
      "topics": [
        "科学解释",
        "工程",
        "幽默",
        "图示"
      ],
      "title": "万物解释者（Thing Explainer）",
      "author": "兰道尔·门罗",
      "catalog_category": "科普/科学思维",
      "catalog_source": "书架实拍 IMG_5685",
      "catalog_note": "",
      "gist": "作者用大约一千个常用词和大量剖面图，解释火箭、细胞、洗衣机等复杂事物，重点在“怎样把难东西说明白”。",
      "child_bridge": "如果只能用很小的词来解释一个很复杂的东西，你会先挑哪个词？为什么说明白比说高级更难？",
      "use_when": [
        "孩子问奇怪的科学问题",
        "喜欢画图和脑洞",
        "想练习把知识讲给别人听"
      ],
      "talk_angles": [
        "挑一个物品，让孩子用自己的话解释",
        "比较“术语版”和“简单版”"
      ],
      "guardrail": "书里的幽默和类比不是严格教材；数字和细节以版本为准",
      "source_grade": "B",
      "source_note": "既有公共书目知识，未逐页核对",
      "related_ids": [
        "bk-0005",
        "bk-0010"
      ]
    },
    {
      "book_id": "bk-0009",
      "group": "child-picture-bridge",
      "group_label": "儿童·图文书与桥梁书",
      "entry_type": "single",
      "audience": "child",
      "age_hint": "9–12",
      "use_modes": [
        "child_read",
        "co_read",
        "discuss"
      ],
      "topics": [
        "数学史",
        "问题解决",
        "学科意义",
        "吴军"
      ],
      "title": "给孩子的数学课",
      "author": "吴军",
      "catalog_category": "数学/学科意义",
      "catalog_source": "书架实拍 IMG_5686",
      "catalog_note": "",
      "gist": "吴军通过数学史和改变世界的问题，讲数学为什么值得学，以及数学思维怎样帮人解决真实问题。",
      "child_bridge": "有些数学题不是为了让老师检查，而是因为当年真的有人被一个问题卡住了。你想知道哪一个问题最让数学家头疼吗？",
      "use_when": [
        "孩子问“学数学有什么用”",
        "聊到数学家或大问题",
        "做完题后仍愿意听背景"
      ],
      "talk_angles": [
        "数学史上的人怎样试错",
        "一个抽象概念怎样变成工具"
      ],
      "guardrail": "不是课内练习册，不在卡题时用它转移注意力；不承诺提高分数",
      "source_grade": "B",
      "source_note": "既有公共书目与既有引读卡片，未逐页核对；可讲大意，不编原句",
      "related_ids": [
        "bk-0010",
        "bk-0155",
        "bk-0171"
      ]
    },
    {
      "book_id": "bk-0010",
      "group": "child-picture-bridge",
      "group_label": "儿童·图文书与桥梁书",
      "entry_type": "single",
      "audience": "child",
      "age_hint": "9–13",
      "use_modes": [
        "child_read",